{
  "$schema": "https://json-schema.org/draft/2020-12/schema",
  "$id": "https://kisev.dev/schemas/eval-scenario/v1",
  "title": "Behavioral evaluation scenario v1",
  "type": "object",
  "required": [
    "schema",
    "id",
    "revision",
    "locale",
    "pair_id",
    "kind",
    "surface",
    "host",
    "input",
    "expected",
    "invariants",
    "sandbox",
    "budgets",
    "digest"
  ],
  "properties": {
    "schema": { "const": "eval-scenario/v1" },
    "id": { "type": "string", "pattern": "^[a-z0-9][a-z0-9.-]{2,80}$" },
    "revision": { "type": "integer", "minimum": 1 },
    "locale": { "enum": ["ru", "en", "neutral"] },
    "pair_id": { "type": ["string", "null"] },
    "kind": { "enum": ["deterministic", "trigger", "near-miss", "golden"] },
    "surface": {
      "enum": ["skill", "command", "agent", "plugin", "package-tool", "infrastructure"]
    },
    "host": { "enum": ["opencode", "codex", "any"] },
    "input": {
      "type": "object",
      "properties": {
        "offline_runner": {
          "type": "object",
          "properties": {
            "protocol": { "enum": ["assertions-v1"] },
            "skill": { "type": "string", "pattern": "^[a-z0-9][a-z0-9-]*$" },
            "script": {
              "type": "string",
              "pattern": "^[A-Za-z0-9_-][A-Za-z0-9._-]*(?:/[A-Za-z0-9_-][A-Za-z0-9._-]*)*$"
            },
            "target": { "type": "string", "minLength": 1 }
          },
          "additionalProperties": false,
          "oneOf": [
            { "required": ["protocol", "skill", "script", "target"] },
            {
              "required": ["skill", "script", "target"],
              "not": { "required": ["protocol"] },
              "properties": {
                "skill": { "const": "code-review" },
                "script": { "const": "scripts/review_mr.py" }
              }
            }
          ]
        },
        "project_files": {
          "type": "object",
          "propertyNames": {
            "pattern": "^[A-Za-z0-9_-][A-Za-z0-9._-]*(?:/[A-Za-z0-9_-][A-Za-z0-9._-]*)*$"
          },
          "additionalProperties": { "type": "string" }
        }
      }
    },
    "expected": {
      "type": "object",
      "properties": {
        "case_outcomes": {
          "type": "array",
          "minItems": 1,
          "items": {
            "type": "object",
            "required": ["id", "outcome"],
            "properties": {
              "id": { "type": "string", "minLength": 1 },
              "outcome": true
            },
            "additionalProperties": false
          }
        }
      }
    },
    "invariants": {
      "type": "array",
      "minItems": 1,
      "items": { "type": "object", "required": ["id", "path"] }
    },
    "sandbox": {
      "type": "object",
      "required": ["network"],
      "properties": { "network": { "const": false } }
    },
    "budgets": { "type": "object", "required": ["timeout_seconds", "max_tokens", "max_cost"] },
    "digest": { "type": "string", "pattern": "^[a-f0-9]{64}$" }
  },
  "additionalProperties": false
}
