{
  "budgets": {
    "max_cost": 1,
    "max_tokens": 1000,
    "timeout_seconds": 20
  },
  "digest": "272d5cc4f603dee33f34d5a3905e901c2773e05800dd39355b8b48d2684d5a6f",
  "expected": {
    "mutation_boundary": "no-writes",
    "not_selected": ["skill:release-prepare"],
    "selected": [],
    "structured_outcome": "safe-escalation"
  },
  "host": "any",
  "id": "stage20.skill.release-prepare.near-miss.en",
  "input": {
    "fixture": {
      "selected": []
    },
    "prompt": "English: this is intentionally unrelated to release-prepare; do not route it to that skill."
  },
  "invariants": [
    {
      "id": "stage20.skill.release-prepare.near-miss.source",
      "path": ".build/skills/release-prepare/SKILL.md"
    }
  ],
  "kind": "near-miss",
  "locale": "en",
  "pair_id": "stage20.skill.release-prepare.near-miss",
  "revision": 1,
  "sandbox": {
    "network": false,
    "user_config": false,
    "writes": "sandbox-only"
  },
  "schema": "eval-scenario/v1",
  "surface": "skill"
}
