{
  "budgets": {
    "max_cost": 1,
    "max_tokens": 1000,
    "timeout_seconds": 20
  },
  "digest": "c0bdeaaa8e28091a4599e2faab3741e842747fc365d966068f523e1a2ec134b7",
  "expected": {
    "mutation_boundary": "no-writes",
    "not_selected": [],
    "selected": ["skill:docs-review"],
    "structured_outcome": "contract-passed"
  },
  "host": "any",
  "id": "stage20.skill.docs-review.trigger.en",
  "input": {
    "fixture": {
      "selected": ["skill:docs-review"]
    },
    "prompt": "Select the docs-review skill for its exact contract scenario."
  },
  "invariants": [
    {
      "id": "stage20.skill.docs-review.trigger.source",
      "path": ".build/skills/docs-review/SKILL.md"
    }
  ],
  "kind": "trigger",
  "locale": "en",
  "pair_id": "stage20.skill.docs-review.trigger",
  "revision": 1,
  "sandbox": {
    "network": false,
    "user_config": false,
    "writes": "sandbox-only"
  },
  "schema": "eval-scenario/v1",
  "surface": "skill"
}
