{
  "budgets": {
    "max_cost": 1,
    "max_tokens": 1000,
    "timeout_seconds": 20
  },
  "digest": "aba1c3bd9d62178f2a12a7bb18a709891f6ddcc14e0a9f1116327aeac32b7c1a",
  "expected": {
    "mutation_boundary": "no-writes",
    "not_selected": [],
    "selected": ["skill:goal"],
    "structured_outcome": "contract-passed"
  },
  "host": "any",
  "id": "stage20.skill.goal.trigger.en",
  "input": {
    "fixture": {
      "selected": ["skill:goal"]
    },
    "prompt": "Select the goal skill for its exact contract scenario."
  },
  "invariants": [
    {
      "id": "stage20.skill.goal.trigger.source",
      "path": ".build/skills/goal/SKILL.md"
    }
  ],
  "kind": "trigger",
  "locale": "en",
  "pair_id": "stage20.skill.goal.trigger",
  "revision": 1,
  "sandbox": {
    "network": false,
    "user_config": false,
    "writes": "sandbox-only"
  },
  "schema": "eval-scenario/v1",
  "surface": "skill"
}
