{
  "budgets": {
    "max_cost": 1,
    "max_tokens": 1000,
    "timeout_seconds": 20
  },
  "digest": "8727dddab08d1ca63a3569503b5d9ed63ecb93e501654f097b1d0f0e2a8e5af9",
  "expected": {
    "mutation_boundary": "adapter-only",
    "not_selected": [],
    "selected": ["command:team-roadmap"],
    "structured_outcome": "contract-passed"
  },
  "host": "any",
  "id": "stage20.command.team-roadmap.contract",
  "input": {
    "fixture": {
      "selected": ["command:team-roadmap"]
    },
    "prompt": "Verify command team-roadmap contract."
  },
  "invariants": [
    {
      "id": "stage20.command.team-roadmap.contract.source",
      "path": "apps/skillmate/src/skillmate/adapters.py"
    }
  ],
  "kind": "deterministic",
  "locale": "neutral",
  "pair_id": null,
  "revision": 1,
  "sandbox": {
    "network": false,
    "user_config": false,
    "writes": "sandbox-only"
  },
  "schema": "eval-scenario/v1",
  "surface": "command"
}
