{
  "budgets": {
    "max_cost": 1,
    "max_tokens": 1000,
    "timeout_seconds": 20
  },
  "digest": "84e1d2c0202cbd6f23ec713ce33732bcc5dfc42d5b448ff11aa533ae084fe7e9",
  "expected": {
    "mutation_boundary": "no-writes",
    "not_selected": [],
    "selected": ["skill:docs-prepare"],
    "structured_outcome": "contract-passed"
  },
  "host": "any",
  "id": "stage20.skill.docs-prepare.trigger.en",
  "input": {
    "fixture": {
      "selected": ["skill:docs-prepare"]
    },
    "prompt": "Select the docs-prepare skill for its exact contract scenario."
  },
  "invariants": [
    {
      "id": "stage20.skill.docs-prepare.trigger.source",
      "path": ".build/skills/docs-prepare/SKILL.md"
    }
  ],
  "kind": "trigger",
  "locale": "en",
  "pair_id": "stage20.skill.docs-prepare.trigger",
  "revision": 1,
  "sandbox": {
    "network": false,
    "user_config": false,
    "writes": "sandbox-only"
  },
  "schema": "eval-scenario/v1",
  "surface": "skill"
}
