{
  "budgets": {
    "max_cost": 1,
    "max_tokens": 1000,
    "timeout_seconds": 20
  },
  "digest": "68e5dd8d7989becc27a9246829ffdd5c05696ad92e31b2d6b28b7483aa99cc72",
  "expected": {
    "mutation_boundary": "no-writes",
    "not_selected": [],
    "selected": ["skill:task-review"],
    "structured_outcome": "contract-passed"
  },
  "host": "any",
  "id": "stage20.skill.task-review.trigger.en",
  "input": {
    "fixture": {
      "selected": ["skill:task-review"]
    },
    "prompt": "Select the task-review skill for its exact contract scenario."
  },
  "invariants": [
    {
      "id": "stage20.skill.task-review.trigger.source",
      "path": ".build/skills/task-review/SKILL.md"
    }
  ],
  "kind": "trigger",
  "locale": "en",
  "pair_id": "stage20.skill.task-review.trigger",
  "revision": 1,
  "sandbox": {
    "network": false,
    "user_config": false,
    "writes": "sandbox-only"
  },
  "schema": "eval-scenario/v1",
  "surface": "skill"
}
