{
  "budgets": {
    "max_cost": 1,
    "max_tokens": 1000,
    "timeout_seconds": 20
  },
  "digest": "665cee85ad18064090139f039ab9358a100b625367786c168a11434adb90e7fe",
  "expected": {
    "mutation_boundary": "adapter-only",
    "not_selected": [],
    "selected": ["command:goal"],
    "structured_outcome": "contract-passed"
  },
  "host": "any",
  "id": "stage20.command.goal.contract",
  "input": {
    "fixture": {
      "selected": ["command:goal"]
    },
    "prompt": "Verify command goal contract."
  },
  "invariants": [
    {
      "id": "stage20.command.goal.contract.source",
      "path": "apps/skillmate/src/skillmate/adapters.py"
    }
  ],
  "kind": "deterministic",
  "locale": "neutral",
  "pair_id": null,
  "revision": 1,
  "sandbox": {
    "network": false,
    "user_config": false,
    "writes": "sandbox-only"
  },
  "schema": "eval-scenario/v1",
  "surface": "command"
}
