{
  "budgets": {
    "max_cost": 1,
    "max_tokens": 1000,
    "timeout_seconds": 20
  },
  "digest": "44c8d65085045b651076007868f3f22fc635f9f0cbdc99c4134bb1cb13a6b945",
  "expected": {
    "mutation_boundary": "no-writes",
    "not_selected": ["skill:lsp-report"],
    "selected": [],
    "structured_outcome": "safe-escalation"
  },
  "host": "any",
  "id": "stage20.skill.lsp-report.near-miss.en",
  "input": {
    "fixture": {
      "selected": []
    },
    "prompt": "English: this is intentionally unrelated to lsp-report; do not route it to that skill."
  },
  "invariants": [
    {
      "id": "stage20.skill.lsp-report.near-miss.source",
      "path": ".build/skills/lsp-report/SKILL.md"
    }
  ],
  "kind": "near-miss",
  "locale": "en",
  "pair_id": "stage20.skill.lsp-report.near-miss",
  "revision": 1,
  "sandbox": {
    "network": false,
    "user_config": false,
    "writes": "sandbox-only"
  },
  "schema": "eval-scenario/v1",
  "surface": "skill"
}
