{
  "budgets": {
    "max_cost": 1,
    "max_tokens": 1000,
    "timeout_seconds": 20
  },
  "digest": "1bd81523403be88986417c2069762b3763b7ba1d5977c1eed690e14433aecb30",
  "expected": {
    "mutation_boundary": "no-writes",
    "not_selected": [],
    "selected": ["skill:team-roadmap"],
    "structured_outcome": "contract-passed"
  },
  "host": "any",
  "id": "stage20.skill.team-roadmap.trigger.en",
  "input": {
    "fixture": {
      "selected": ["skill:team-roadmap"]
    },
    "prompt": "Select the team-roadmap skill for its exact contract scenario."
  },
  "invariants": [
    {
      "id": "stage20.skill.team-roadmap.trigger.source",
      "path": ".build/skills/team-roadmap/SKILL.md"
    }
  ],
  "kind": "trigger",
  "locale": "en",
  "pair_id": "stage20.skill.team-roadmap.trigger",
  "revision": 1,
  "sandbox": {
    "network": false,
    "user_config": false,
    "writes": "sandbox-only"
  },
  "schema": "eval-scenario/v1",
  "surface": "skill"
}
