{
  "budgets": {
    "max_cost": 1,
    "max_tokens": 1000,
    "timeout_seconds": 20
  },
  "digest": "fa6dcc6d8460b85475e1b302a9d7a1320acb51702e9cf74e1989f81763f445c3",
  "expected": {
    "mutation_boundary": "no-writes",
    "not_selected": [],
    "selected": ["skill:handoff"],
    "structured_outcome": "contract-passed"
  },
  "host": "any",
  "id": "stage20.skill.handoff.trigger",
  "input": {
    "fixture": {
      "selected": ["skill:handoff"]
    },
    "prompt": "\u0412\u044b\u0431\u0435\u0440\u0438 \u043d\u0430\u0432\u044b\u043a handoff \u0434\u043b\u044f \u0435\u0433\u043e \u0442\u043e\u0447\u043d\u043e\u0433\u043e \u043a\u043e\u043d\u0442\u0440\u0430\u043a\u0442\u043d\u043e\u0433\u043e \u0441\u0446\u0435\u043d\u0430\u0440\u0438\u044f."
  },
  "invariants": [
    {
      "id": "stage20.skill.handoff.trigger.source",
      "path": ".build/skills/handoff/SKILL.md"
    }
  ],
  "kind": "trigger",
  "locale": "ru",
  "pair_id": "stage20.skill.handoff.trigger",
  "revision": 1,
  "sandbox": {
    "network": false,
    "user_config": false,
    "writes": "sandbox-only"
  },
  "schema": "eval-scenario/v1",
  "surface": "skill"
}
