{
  "schema": "eval-scenario/v1",
  "id": "stage18.routing.near-miss",
  "revision": 1,
  "kind": "near-miss",
  "locale": "ru",
  "pair_id": "stage18.routing.near-miss",
  "surface": "agent",
  "host": "opencode",
  "input": {
    "prompt": "Не маршрутизируй, просто объясни разницу между mapper и worker.",
    "fixture": {
      "selected": []
    }
  },
  "expected": {
    "selected": [],
    "not_selected": ["agent:mapper", "agent:worker"]
  },
  "invariants": [
    {
      "id": "four-destinations",
      "path": "packages/agentomatic/src/routing.ts",
      "contains": "CATEGORIES"
    }
  ],
  "sandbox": {
    "network": false,
    "user_config": false,
    "writes": "sandbox-only"
  },
  "budgets": {
    "timeout_seconds": 20,
    "max_tokens": 1000,
    "max_cost": 1
  },
  "digest": "26385e343c6ccb0d2a92afab70ebbc3d0693cafa5a53cbc314f43f1f1f3c766b"
}
