{
  "budgets": {
    "max_cost": 1,
    "max_tokens": 1000,
    "timeout_seconds": 20
  },
  "digest": "cb94a74d2b5dc90ec0793cb22bfb338fd2347c8a61db15d2622d3d80965b78af",
  "expected": {
    "mutation_boundary": "no-writes",
    "not_selected": [],
    "selected": ["skill:team-people"],
    "structured_outcome": "contract-passed"
  },
  "host": "any",
  "id": "stage20.skill.team-people.trigger",
  "input": {
    "fixture": {
      "selected": ["skill:team-people"]
    },
    "prompt": "\u0412\u044b\u0431\u0435\u0440\u0438 \u043d\u0430\u0432\u044b\u043a team-people \u0434\u043b\u044f \u0435\u0433\u043e \u0442\u043e\u0447\u043d\u043e\u0433\u043e \u043a\u043e\u043d\u0442\u0440\u0430\u043a\u0442\u043d\u043e\u0433\u043e \u0441\u0446\u0435\u043d\u0430\u0440\u0438\u044f."
  },
  "invariants": [
    {
      "id": "stage20.skill.team-people.trigger.source",
      "path": ".build/skills/team-people/SKILL.md"
    }
  ],
  "kind": "trigger",
  "locale": "ru",
  "pair_id": "stage20.skill.team-people.trigger",
  "revision": 1,
  "sandbox": {
    "network": false,
    "user_config": false,
    "writes": "sandbox-only"
  },
  "schema": "eval-scenario/v1",
  "surface": "skill"
}
