{
  "budgets": {
    "max_cost": 1,
    "max_tokens": 1000,
    "timeout_seconds": 20
  },
  "digest": "f99203d6f4c05d386b930c2743408a5333c4035993c9615073a521b7e374395c",
  "expected": {
    "mutation_boundary": "no-writes",
    "not_selected": ["skill:humanize"],
    "selected": [],
    "structured_outcome": "safe-escalation"
  },
  "host": "any",
  "id": "stage20.skill.humanize.near-miss",
  "input": {
    "fixture": {
      "selected": []
    },
    "prompt": "\u041e\u0442\u0440\u0435\u0444\u0430\u043a\u0442\u043e\u0440\u0438 \u0444\u0443\u043d\u043a\u0446\u0438\u044e format_price \u0432 src/pricing.py \u0438 \u043e\u0431\u043d\u043e\u0432\u0438 \u0435\u0451 docstring."
  },
  "invariants": [
    {
      "id": "stage20.skill.humanize.near-miss.source",
      "path": ".build/skills/humanize/SKILL.md"
    },
    {
      "contains": "never activates this skill by itself",
      "id": "humanize-explicit-activation",
      "path": "skills/humanize/SKILL.source.md"
    }
  ],
  "kind": "near-miss",
  "locale": "ru",
  "pair_id": "stage20.skill.humanize.near-miss",
  "revision": 2,
  "sandbox": {
    "network": false,
    "user_config": false,
    "writes": "sandbox-only"
  },
  "schema": "eval-scenario/v1",
  "surface": "skill"
}
