{
  "schema": "eval-scenario/v1",
  "id": "golden.goal.work-item.en",
  "revision": 2,
  "kind": "golden",
  "surface": "skill",
  "host": "any",
  "input": {
    "prompt": "/goal prepare a verifiable read-only objective",
    "fixture": {
      "selected": ["skill:goal"]
    }
  },
  "expected": {
    "selected": ["skill:goal"],
    "not_selected": []
  },
  "invariants": [
    {
      "id": "goal-budget",
      "path": "skills/goal/references/workflow.md",
      "contains": "at or below 4000 characters"
    },
    {
      "id": "goal-work-item",
      "path": "skills/goal/references/workflow.md",
      "contains": "structured Markdown rather than JSON"
    }
  ],
  "sandbox": {
    "network": false,
    "user_config": false,
    "writes": "sandbox-only"
  },
  "budgets": {
    "timeout_seconds": 20,
    "max_tokens": 3000,
    "max_cost": 1
  },
  "digest": "b8c2a6c6932e635bc5f08ca41e348584c4fcfdd9983090c1a8c1bd5c27382def",
  "locale": "en",
  "pair_id": "golden.goal.work-item"
}
